"Name","has.star","Title.type","Genre","Run.time","Top.cast","MOVIEmeter","IMDb.Rating","Production.Co.","Year","numvotes","Country","Language","Rating","Genres"
"The Maltese Falcon",1,"Movie","Crime, Film-Noir, Mystery",100,"Humphrey Bogart, Mary Astor, Gladys George",5871,8,"Warner Bros.",1941,116339,"US","English",2,"Horror/Thriller"
"The Man Who Knew Too Much",1,"Movie","Drama, Thriller",120,"James Stewart, Doris Day, Brenda de Banzie",7012,7.4,"Paramount Pictures",1956,21780,"US","English",3,"Light"
"The Man Who Wasn't There",0,"Movie","Crime, Drama",116,"Billy Bob Thornton, Frances McDormand, Michael Badalucco",6475,7.5,"Good Machine",2001,15496,"US","English",3,"Drama"
"The Newton Boys",1,"Movie","Action, Crime, Drama",122,"Matthew McConaughey, Skeet Ulrich, Ethan Hawke",13604,6.1,"Twentieth Century Fox",1998,22914,"US","English",3,"Action"
"The Night of the Hunter",0,"Movie","Crime, Drama, Film-Noir",92,"Shelley Winters, Lillian Gish, James Gleason",6462,8,"Paul Gregory Productions",1955,41285,"US","English",2,"Horror/Thriller"
"The Outlaw Josey Wales",0,"Movie","Western",135,"Chief Dan George, Sondra Locke, Bill McKinney",5678,7.8,"Warner Bros.",1976,21325,"US","English",1,"Action"
"The Passenger",1,"Movie","Drama, Thriller",126,"Jack Nicholson, Maria Schneider, Jenny Runacre",10774,7.6,"Metro-Goldwyn-Mayer (MGM)",1975,66311,"EU","English",3,"Horror/Thriller"
"The Prestige",1,"Movie","Drama, Mystery, Sci-Fi",130,"Hugh Jackman, Christian Bale, Michael Caine",405,8.5,"Touchstone Pictures",2006,124389,"US","English",3,"Drama"
"The Royal Tenenbaums",1,"Movie","Comedy, Drama",110,"Gene Hackman, Anjelica Huston, Ben Stiller",2071,7.6,"Touchstone Pictures",2001,84364,"US","English",2,"Drama"
"The Shining",1,"Movie","Drama, Horror",146,"Jack Nicholson, Shelley Duvall, Danny Lloyd",696,8.4,"Warner Bros.",1980,7950,"US","English",4,"Horror/Thriller"
"The Skin I Live In",1,"Movie","Drama, Horror, Thriller",120,"Antonio Banderas, Elena Anaya, Marisa Paredes",3482,7.6,"Blue Haze Entertainment",2011,3059,"SP","Spanish",3,"Horror/Thriller"
"The Tenant",1,"Movie","Drama, Thriller",126,"Isabelle Adjani, Melvyn Douglas, Jo Van Fleet",7838,7.7,"Marianne Productions",1976,111533,"EU","English",1,"Horror/Thriller"
"The Terminal",1,"Movie","Comedy, Drama, Romance",128,"Tom Hanks, Catherine Zeta-Jones, Stanley Tucci",1642,7.4,"Dreamworks Pictures",2004,35238,"US","English",2,"Romance"
"The War Room",0,"Movie","Documentary, History",96,NA,43136,7.3,"Cyclone Films",1993,16081,"US","English",4,"Drama"
"The Wicker Man",1,"Movie","Horror, Mystery, Thriller",88,"Edward Woodward, Christopher Lee, Diane Cilento",3227,7.5,"British Lion Film Corporation",1973,56654,"UK","English",4,"Horror/Thriller"
"The Wild Bunch",1,"Movie","Action, Adventure, Western",145,"William Holden, Ernest Borgnine, Robert Ryan",5187,7.9,"Warner Bros./Seven Arts",1969,26104,"US","English",1,"Action"
"The Wolf of Wall Street",1,"Movie","Biography, Crime, Drama",180,"Jonah Hill, Margot Robbie, Matthew McConaughey",257,8.2,"Red Granite Pictures",2013,100466,"US","English",3,"Drama"
"The World's End",0,"Movie","Comedy, Sci-Fi",109,"Thomas Law, Zachary Bailess, Jasper Levine",3163,7,"Universal Pictures",2013,20470,"UK","English",3,"Light"
"The Yakuza",1,"Movie","Action, Crime, Drama",112,"Robert Mitchum, Ken Takakura, Brian Keith",17460,7.2,"Warner Bros.",1974,17542,"US","English",2,"Action"
"The Young Girls of Rochefort",1,"Movie","Comedy, Drama, Musical",120,"Catherine Deneuve, George Chakiris, Françoise Dorléac",14553,7.7,"Parc Film",1967,9583,"FR","French",2,"Light"
"This Is England",0,"Movie","Crime, Drama",101,"Thomas Turgoose, Stephen Graham, Jo Hartley",3016,7.7,"Warp Films",2006,81681,"UK","English",4,"Drama"
"Three Billboards Outside Ebbing, Missouri",0,"Movie","Comedy, Crime, Drama",115,"Frances McDormand, Caleb Landry Jones, Kerry Condon",791,8.1,"Blueprint Pictures",2017,11391,"US","English",2,"Drama"
"Tie Me Up! Tie Me Down!",1,"Movie","Comedy, Crime, Drama",101,"Victoria Abril, Antonio Banderas, Loles León",7221,7,"El Deseo",1989,1012,"SP","Spanish",3,"Drama"
"Tinker Tailor Soldier Spy",1,"Movie","Drama, Mystery, Thriller",122,"Mark Strong, John Hurt, Zoltán Mucsi",2113,7.1,"StudioCanal",2011,13253,"UK","English",2,"Horror/Thriller"
"To Catch a Thief",1,"Movie","Mystery, Romance, Thriller",106,"Cary Grant, Grace Kelly, Jessie Royce Landis",2916,7.4,"Paramount Pictures",1955,2098,"US","English",4,"Romance"
"Tomboy",0,"Movie","Drama",82,"Zoé Héran, Malonn Lévana, Jeanne Disson",14370,7.4,"Hold Up Films",2011,5703,"FR","French",1,"Drama"
"Top Hat",0,"Movie","Comedy, Musical, Romance",101,"Ginger Rogers, Edward Everett Horton, Erik Rhodes",16310,7.7,"RKO Radio Pictures",1935,8521,"US","English",4,"Romance"
"Torso",0,"Movie","Horror, Mystery, Thriller",89,"Suzy Kendall, Tina Aumont, Luc Merenda",13399,6.5,"Compagnia Cinematografica Champion",1973,9662,"IT","Italian",2,"Horror/Thriller"
"Touch of Evil",1,"Movie","Crime, Drama, Film-Noir",95,"Charlton Heston, Janet Leigh, Joseph Calleia",6535,8,"Universal International Pictures (UI)",1958,25073,"US","English",3,"Horror/Thriller"
"Training Day",1,"Movie","Crime, Drama, Thriller",122,"Denzel Washington, Ethan Hawke, Scott Glenn",1006,7.7,"Warner Bros.",2001,32946,"US","English",2,"Drama"
"Trainspotting",1,"Movie","Drama",93,"Ewan McGregor, Ewen Bremner, Jonny Lee Miller",1074,8.1,"Channel Four Films",1996,27570,"UK","English",4,"Drama"
"Tropic Thunder",1,"Movie","Action, Comedy, War",107,"Jeff Kahn, Robert Downey Jr., Anthony Ruivivar",831,7,"Dreamworks Pictures",2008,29365,"US","English",3,"Action"
"Two Women",1,"Movie","Drama, War",101,"Sophia Loren, Jean-Paul Belmondo, Eleonora Brown",10589,7.8,"Compagnia Cinematografica Champion",1960,3449,"IT","Italian",2,"Drama"
"Tyrannosaur",0,"Movie","Drama",92,"Peter Mullan, Archie Lal, Jag Sanghera",9480,7.6,"Warp X",2011,7108,"UK","English",3,"Drama"
"Uncut Gems",0,"Movie","Crime, Drama, Thriller",135,"Mesfin Lamengo, Sun Zhi Hua-Hilton, Liang Wei-Hui-Duncan",757,7.4,"A24",2019,4011,"US","English",1,"Drama"
"Unforgiven",1,"Movie","Drama, Western",130,"Gene Hackman, Morgan Freeman, Richard Harris",1369,8.2,"Warner Bros.",1992,17652,"US","English",3,"Action"
"Unrelated",0,"Movie","Drama",100,"Kathryn Worth, Harry Kershaw, Emma Hiddleston",20221,6.8,"Raw Siena",2007,8700,"UK","English",1,"Light"
"Vertigo",1,"Movie","Mystery, Romance, Thriller",128,"James Stewart, Kim Novak, Barbara Bel Geddes",2257,8.3,"Alfred J. Hitchcock Productions",1958,18853,"US","English",4,"Romance"
"Videodrome",1,"Movie","Horror, Sci-Fi, Thriller",87,"James Woods, Sonja Smits, Debbie Harry",5814,7.2,"Filmplan International",1983,15870,"CA","English",4,"Horror/Thriller"
"Vivacious Lady",1,"Movie","Comedy, Romance",90,"Ginger Rogers, James Stewart, James Ellison",44538,7.2,"RKO Radio Pictures",1938,59320,"US","English",3,"Romance"
"Volver",0,"Movie","Comedy, Drama",121,"Penélope Cruz, Carmen Maura, Lola Dueñas",7504,7.6,"Canal+ España",2006,10847,"SP","Spanish",3,"Drama"
"Wake in Fright",0,"Movie","Drama, Thriller",109,"Donald Pleasence, Gary Bond, Chips Rafferty",10870,7.7,"NLT Productions",1971,104745,"AU","English",3,"Drama"
"Water Lilies",0,"Movie","Drama, Romance",85,"Pauline Acquart, Louise Blachère, Adèle Haenel",10760,6.7,"Balthazar Productions",2007,66190,"FR","French",2,"Romance"
"Wild for Kicks",1,"Movie","Drama",89,"David Farrar, Noëlle Adam, Christopher Lee",36746,6,"Willoughby Film Productions",1960,31838,"UK","English",3,"Light"
"Women on the Verge of a Nervous Breakdown",1,"Movie","Comedy, Drama",88,"Carmen Maura, Antonio Banderas, Julieta Serrano",7760,7.6,"Laurenfilm",1988,26765,"SP","Spanish",3,"Light"
"Yesterday, Today and Tomorrow",1,"Movie","Comedy, Romance",114,"Sophia Loren, Marcello Mastroianni, Aldo Giuffrè",11200,7.3,"Compagnia Cinematografica Champion",1963,66302,"IT","Italian",2,"Romance"
"You Were Never Really Here",0,"Movie","Crime, Drama",89,"Joaquin Phoenix, Dante Pereira-Olson, Larry Canady",2676,6.8,"Why Not Productions",2017,42591,"US","English",2,"Drama"
