"Name","has.star","Title.type","Genre","Run.time","Top.cast","MOVIEmeter","IMDb.Rating","Production.Co.","Year","numvotes","Country","Language","Rating","Genres"
"Magnum Force",1,"Movie","Action, Crime, Mystery",124,"Clint Eastwood, Hal Holbrook, Mitchell Ryan",6384,7.2,"The Malpaso Company",1973,43169,"US","English",4,"Action"
"Make Up",0,"Movie","Drama",86,"Molly Windsor, Joseph Quinn, Stefanie Martini",15818,6,"BBC Films",2019,150036,"UK","English",1,"Drama"
"Manhattan",1,"Movie","Comedy, Drama, Romance",96,"Diane Keaton, Michael Murphy, Mariel Hemingway",5298,7.9,"Jack Rollins & Charles H. Joffe Productions",1979,45079,"US","English",3,"Romance"
"Mank",1,"Movie","Biography, Comedy, Drama",131,"Gary Oldman, Amanda Seyfried, Lily Collins",183,7,"Netflix",2020,99068,"US","English",1,"Drama"
"Matchstick Men",1,"Movie","Comedy, Crime, Drama",116,"Nicolas Cage, Sam Rockwell, Alison Lohman",7613,7.3,"Warner Bros.",2003,58892,"US","English",2,"Drama"
"Mean Streets",1,"Movie","Crime, Drama, Thriller",112,"Robert De Niro, Harvey Keitel, David Proval",5153,7.2,"Warner Bros.",1973,67459,"US","English",4,"Drama"
"Memento",0,"Movie","Mystery, Thriller",113,"Guy Pearce, Carrie-Anne Moss, Joe Pantoliano",923,8.4,"Newmarket Capital Group",2000,27606,"US","English",3,"Horror/Thriller"
"Memories of Murder",0,"Movie","Crime, Drama, Mystery",131,"Kang-ho Song, Kim Sang-kyung, Roe-ha Kim",1616,8.1,"CJ Entertainment",2003,200279,"SK","Korean",3,"Drama"
"Meshes of the Afternoon",0,"Short","Short, Fantasy, Mystery",14,NA,25636,7.9,NA,1943,27338,"US","English",1,"Drama"
"Midnight Coffee",0,"Short","Short, Comedy",12,"Sean Edward Evans, Vianny Guevara, Charles Mai",296286,NA,NA,2020,253495,"US","English",1,"Light"
"Midnight in Paris",0,"Movie","Comedy, Fantasy, Romance",94,"Owen Wilson, Rachel McAdams, Kurt Fuller",1622,7.7,"Mediapro",2011,82815,"US","English",3,"Romance"
"Miller's Crossing",1,"Movie","Crime, Drama, Thriller",115,"Gabriel Byrne, Marcia Gay Harden, John Turturro",4428,7.7,"Circle Films",1990,33293,"US","English",2,"Drama"
"Monkey Business",1,"Movie","Comedy, Sci-Fi",97,"Cary Grant, Ginger Rogers, Charles Coburn",19014,7,"Twentieth Century Fox",1952,196561,"US","English",2,"Light"
"Moon",1,"Movie","Drama, Mystery, Sci-Fi",97,"Sam Rockwell, Kevin Spacey, Dominique McElligott",2400,7.9,"Sony Pictures Classics",2009,447783,"US","English",3,"Drama"
"Morvern Callar",0,"Movie","Drama",97,"Samantha Morton, Kathleen McDermott, Paul Popplewell",19135,6.8,"Alliance Atlantis Motion Picture Production",2002,11675,"US","English",2,"Drama"
"Mosquito",0,"Movie","Drama, War",125,"João Nunes Monteiro, João Lagarto, Filipe Duarte",53364,7,"APM - Ana Pinhão Moura Produções",2020,79350,"PO","English",3,"Action"
"Mother",0,"Movie","Crime, Drama, Mystery",129,"Hye-ja Kim, Won Bin, Jin Goo",5213,7.8,"CJ Entertainment",2009,124248,"SK","Korean",4,"Drama"
"My Name Is Joe",0,"Movie","Drama, Romance",105,"Peter Mullan, Louise Goodall, Gary Lewis",31263,7.5,"ARD Degeto Film",1998,93082,"UK","English",4,"Romance"
"My Night at Maud's",0,"Movie","Comedy, Drama, Romance",110,"Jean-Louis Trintignant, Françoise Fabian, Marie-Christine Barrault",15124,7.9,"Compagnie Française de Distribution Cinématographique (CFDC)",1969,69943,"FR","French",2,"Romance"
"Naked",0,"Movie","Comedy, Drama",132,"David Thewlis, Lesley Sharp, Katrin Cartlidge",4036,7.8,"Thin Man Films",1993,604952,"UK","English",2,"Horror/Thriller"
"Nashville",0,"Movie","Comedy, Drama, Music",160,"David Arkin, Barbara Baxley, Ned Beatty",8267,7.7,"ABC Entertainment",1975,78045,"US","English",1,"Light"
"No Country for Old Men",1,"Movie","Crime, Drama, Thriller",122,"Tommy Lee Jones, Javier Bardem, Josh Brolin",429,8.1,"Paramount Vantage",2007,12935,"US","English",4,"Drama"
"North by Northwest",1,"Movie","Adventure, Mystery, Thriller",136,"Cary Grant, Eva Marie Saint, James Mason",2484,8.3,"Metro-Goldwyn-Mayer (MGM)",1959,600100,"US","English",3,"Light"
"Notorious",1,"Movie","Drama, Film-Noir, Romance",102,"Cary Grant, Ingrid Bergman, Claude Rains",6758,7.9,"RKO Radio Pictures",1946,337850,"US","English",3,"Horror/Thriller"
"O Brother, Where Art Thou?",1,"Movie","Adventure, Comedy, Crime",107,"George Clooney, John Turturro, Tim Blake Nelson",1941,7.7,"Touchstone Pictures",2000,393578,"US","English",1,"Light"
"Obsession",0,"Movie","Drama, Mystery, Thriller",98,"Cliff Robertson, Geneviève Bujold, John Lithgow",16002,6.7,"Columbia Pictures",1976,132474,"US","English",3,"Horror/Thriller"
"Oggi, domani, dopodomani",1,"Movie","Comedy",85,"Marcello Mastroianni, Catherine Spaak, Virna Lisi",93177,6.2,"Compagnia Cinematografica Champion",1965,326812,"IT","Italian",2,"Light"
"On the Edge",0,"Movie","Drama",85,"Paul Hickey, Camille O'Sullivan, Cillian Murphy",29994,7,"Blank Page Productions",2001,51635,"IR","English",1,"Drama"
"On the Rocks",1,"Movie","Comedy, Drama, Romance",96,"Bill Murray, Rashida Jones, Marlon Wayans",2752,6.5,"A24",2020,168173,"US","English",1,"Romance"
"Once Upon a Time in America",1,"Movie","Crime, Drama",229,"Robert De Niro, James Woods, Elizabeth McGovern",1025,8.4,"The Ladd Company",1984,397060,"US","English",4,"Drama"
"Once Upon a Time in the Midlands",0,"Movie","Comedy, Drama, Romance",104,"Robert Carlyle, Vanessa Feltz, Ricky Tomlinson",13626,6.2,"FilmFour",2002,49975,"UK","English",2,"Romance"
"Once Upon a Time in the West",1,"Movie","Western",165,"Claudia Cardinale, Henry Fonda, Jason Robards",1111,8.5,"Rafran Cinematografica",1968,327985,"IT","English",3,"Action"
"One Deadly Summer",1,"Movie","Drama, Mystery",133,"Isabelle Adjani, Alain Souchon, Suzanne Flon",8858,7.3,"Société Nouvelle de Cinématographie (SNC)",1983,384653,"FR","French",3,"Drama"
"One Flew Over the Cuckoo's Nest",0,"Movie","Drama",133,"Michael Berryman, Peter Brocco, Alonzo Brown",868,8.7,"Fantasy Films",1975,448197,"US","English",2,"Drama"
"Out of the Past",1,"Movie","Crime, Drama, Film-Noir",97,"Robert Mitchum, Jane Greer, Kirk Douglas",11387,8,"RKO Radio Pictures",1947,272626,"US","English",3,"Horror/Thriller"
"Outlaw",1,"Movie","Action, Crime, Drama",103,"Sean Bean, Danny Dyer, Rupert Friend",31505,5.7,"Pathe Productions",2007,333728,"UK","English",1,"Action"
"Pain and Glory",1,"Movie","Drama",113,"Antonio Banderas, Asier Etxeandia, Leonardo Sbaraglia",5466,7.5,"Canal+",2019,566454,"SP","Spanish",1,"Drama"
"Paint Your Wagon",1,"Movie","Comedy, Drama, Musical",164,"Lee Marvin, Clint Eastwood, Jean Seberg",11605,6.6,"Alan Jay Lerner Productions",1969,381940,"US","English",1,"Light"
"Parasite",0,"Movie","Comedy, Drama, Thriller",132,"Kang-ho Song, Sun-kyun Lee, Yeo-jeong Cho",193,8.6,"Barunson E&A",2019,467963,"SK","Korean",4,"Drama"
"Paris, Texas",0,"Movie","Drama",145,"Harry Dean Stanton, Sam Berry, Bernhard Wicki",2635,8.1,"Road Movies Filmproduktion",1984,21180,"GE","English",4,"Romance"
"Paul",0,"Movie","Adventure, Comedy, Sci-Fi",104,"Mia Stallard, Jeremy Owen, Jeffrey Tambor",3328,7,"Universal Pictures",2011,396961,"UK","English",2,"Light"
"Pauline at the Beach",0,"Movie","Comedy, Drama, Romance",95,"Amanda Langlet, Arielle Dombasle, Pascal Greggory",9295,7.3,"Les Films Ariane",1983,420292,"FR","French",3,"Romance"
"Peeping Tom",0,"Movie","Drama, Horror, Thriller",101,"Karlheinz Böhm, Moira Shearer, Anna Massey",10592,7.7,"Michael Powell (Theatre)",1960,14004,"UK","English",2,"Horror/Thriller"
"Performance",0,"Movie","Crime, Drama",105,"James Fox, Mick Jagger, Anita Pallenberg",10208,6.9,"Goodtimes Enterprises",1970,112278,"UK","English",1,"Horror/Thriller"
"Persepolis",1,"Movie","Animation, Biography, Drama",96,"Chiara Mastroianni, Danielle Darrieux, Catherine Deneuve",9670,8,"2.4.7. Films",2007,516699,"FR","French",4,"Drama"
"Pineapple Express",0,"Movie","Action, Comedy, Crime",111,"James Franco, Danny McBride, Kevin Corrigan",3168,6.9,"Columbia Pictures",2008,168485,"US","English",2,"Action"
"Play Misty for Me",0,"Movie","Drama, Thriller",102,"Jessica Walter, Donna Mills, John Larch",4340,7,"The Malpaso Company",1971,392049,"US","English",4,"Drama"
"Portrait of a Lady on Fire",0,"Movie","Drama, Romance",122,"Noémie Merlant, Adèle Haenel, Luàna Bajrami",985,8.1,"Lilies Films",2019,412210,"FR","French",3,"Romance"
"Possession",1,"Movie","Drama, Horror",124,"Isabelle Adjani, Sam Neill, Margit Carstensen",3657,7.4,"Gaumont",1981,337773,"EU","English",4,"Horror/Thriller"
"Possessor",0,"Movie","Horror, Mystery, Sci-Fi",103,"Gabrielle Graham, Hanneke Talbot, Matthew Garlick",997,6.5,"Rhombus Media",2020,125485,"CA","English",3,"Horror/Thriller"
"Psycho",0,"Movie","Horror, Mystery, Thriller",109,"Anthony Perkins, Vera Miles, John Gavin",1228,8.5,"Shamley Productions",1960,54954,"US","English",3,"Horror/Thriller"
"Pulp Fiction",1,"Movie","Crime, Drama",154,"Tim Roth, Amanda Plummer, John Travolta",294,8.9,"Miramax",1994,72958,"US","English",4,"Drama"
"Raging Bull",1,"Movie","Biography, Drama, Sport",129,"Robert De Niro, Cathy Moriarty, Joe Pesci",2639,8.2,"Chartoff-Winkler Productions",1980,290698,"US","English",4,"Drama"
"Rashomon",0,"Movie","Crime, Drama, Mystery",88,"Toshirô Mifune, Machiko Kyô, Masayuki Mori",5698,8.2,"Daiei",1950,269819,"JA","Japanese",3,"Drama"
"Rear Window",1,"Movie","Mystery, Thriller",112,"James Stewart, Grace Kelly, Wendell Corey",2157,8.4,"Alfred J. Hitchcock Productions",1954,189362,"US","English",3,"Drama"
"Rebel Without a Cause",1,"Movie","Drama",111,"James Dean, Natalie Wood, Sal Mineo",4198,7.7,"Warner Bros.",1955,169802,"US","English",1,"Light"
"Red Road",0,"Movie","Drama, Mystery, Thriller",113,"Kate Dickie, Tony Curran, Martin Compston",16095,6.8,"Advanced Party Scheme",2006,169945,"UK","English",3,"Horror/Thriller"
"Repo Man",1,"Movie","Action, Comedy, Crime",92,"Harry Dean Stanton, Emilio Estevez, Tracey Walter",6452,6.9,"Edge City Productions",1984,424440,"US","English",2,"Action"
"Repulsion",1,"Movie","Drama, Horror, Thriller",105,"Catherine Deneuve, Ian Hendry, John Fraser",8941,7.7,"Compton Films",1965,225393,"UK","English",1,"Horror/Thriller"
"Reservoir Dogs",0,"Movie","Crime, Drama, Thriller",99,"Tim Roth, Michael Madsen, Chris Penn",905,8.3,"Live Entertainment",1992,106921,"US","English",4,"Drama"
"Rio Bravo",1,"Movie","Action, Drama, Western",141,"John Wayne, Dean Martin, Ricky Nelson",4255,8,"Armada Productions",1959,NA,"US","English",3,"Action"
"Rolling Thunder",1,"Movie","Crime, Drama, Thriller",95,"William Devane, Tommy Lee Jones, Linda Haynes",12091,7,"American International Pictures (AIP)",1977,11412,"US","English",3,"Drama"
"Rome, Open City",0,"Movie","Drama, Thriller, War",103,"Aldo Fabrizi, Anna Magnani, Marcello Pagliero",19670,8.1,"Excelsa Film",1945,20359,"IT","Italian",2,"Drama"
"Rosemary's Baby",0,"Movie","Drama, Horror",137,"Mia Farrow, John Cassavetes, Ruth Gordon",2557,8,"William Castle Productions",1968,597,"US","English",4,"Horror/Thriller"
"Rumble Fish",1,"Movie","Crime, Drama, Romance",94,"Matt Dillon, Mickey Rourke, Diane Lane",6216,7.2,"Zoetrope Studios",1983,9068,"US","English",1,"Romance"
"Rushmore",1,"Movie","Comedy, Drama, Romance",93,"Jason Schwartzman, Bill Murray, Olivia Williams",3074,7.7,"American Empirical Pictures",1998,18792,"US","English",4,"Romance"
"Saint Maud",1,"Movie","Drama, Horror, Mystery",84,"Morfydd Clark, Jennifer Ehle, Lily Knight",1212,6.8,"Escape Plan Productions",2019,3460,"UK","English",4,"Horror/Thriller"
"Salvador",1,"Movie","Drama, History, Thriller",122,"James Woods, Jim Belushi, Michael Murphy",13263,7.4,"Cinema '84",1986,84810,"US","English",4,"Drama"
"Saturday Night Fever",1,"Movie","Drama, Music",118,"John Travolta, Karen Lynn Gorney, Barry Miller",1880,6.8,"Paramount Pictures",1977,11958,"US","English",3,"Light"
"Scanners",0,"Movie","Horror, Sci-Fi, Thriller",103,"Jennifer O'Neill, Stephen Lack, Patrick McGoohan",6108,6.8,"Canadian Film Development Corporation (CFDC)",1981,3578,"CA","English",2,"Horror/Thriller"
"Scarface",1,"Movie","Crime, Drama",170,"Al Pacino, Steven Bauer, Michelle Pfeiffer",833,8.3,"Universal Pictures",1983,100847,"US","English",4,"Drama"
"School of Rock",0,"Movie","Comedy, Music",109,"Jack Black, Adam Pascal, Lucas Papaelias",630,7.1,"Paramount Pictures",2003,36559,"US","English",3,"Light"
"Scott Pilgrim vs. the World",0,"Movie","Action, Comedy, Fantasy",112,"Michael Cera, Kieran Culkin, Anna Kendrick",535,7.5,"Universal Pictures",2010,7111,"US","English",4,"Action"
"Seven Psychopaths",0,"Movie","Comedy, Crime",110,"Michael Pitt, Michael Stuhlbarg, Sam Rockwell",2659,7.2,"CBS Films",2012,901,"US","English",3,"Light"
"Shampoo",1,"Movie","Comedy, Drama",110,"Julie Christie, Goldie Hawn, Lee Grant",8374,6.4,"Persky-Bright / Vista",1975,32504,"US","English",2,"Light"
"Shark Tale",1,"Movie","Animation, Adventure, Comedy",90,"Will Smith, Robert De Niro, Renée Zellweger",4384,6,"DreamWorks Animation",2004,3903,"US","English",3,"Light"
"Shaun of the Dead",0,"Movie","Comedy, Horror",99,"Kate Ashfield, Nick Frost, Lucy Davis",1367,7.9,"Universal Pictures",2004,168629,"UK","English",4,"Horror/Thriller"
"Singin' in the Rain",0,"Movie","Comedy, Musical, Romance",103,"Donald O'Connor, Debbie Reynolds, Jean Hagen",3018,8.3,"Metro-Goldwyn-Mayer (MGM)",1952,5715,"US","English",4,"Light  Romance"
"Sisters",0,"Movie","Horror, Mystery, Thriller",93,"Margot Kidder, Jennifer Salt, Charles Durning",12832,6.9,"Pressman-Williams Enterprises",1972,50142,"US","English",3,"Horror/Thriller"
"Six Shooter",0,"Short","Short, Comedy, Drama",27,"Brendan Gleeson, Rúaidhrí Conroy, David Wilmot",16653,7.5,"FilmFour",2004,8713,"IR","English",2,"Drama"
"Sleuth",1,"Movie","Mystery, Thriller",138,"Laurence Olivier, Michael Caine, Alec Cawthorne",9179,8,"Palomar Pictures International",1972,3247,"UK","English",1,"Drama"
"Snowpiercer",1,"Movie","Action, Drama, Sci-Fi",126,"Chris Evans, Kang-ho Song, Ed Harris",391,7.1,"SnowPiercer",2013,11284,"US","English",3,"Action"
"Society",0,"Movie","Comedy, Horror",99,"Billy Warlock, Concetta D'Agnese, Ben Slack",5713,6.6,"Wild Street Pictures",1989,184,"US","English",3,"Horror/Thriller"
"Some Like It Hot",1,"Movie","Comedy, Music, Romance",121,"Marilyn Monroe, Tony Curtis, Jack Lemmon",1863,8.2,"Ashton Productions",1959,14674,"US","English",4,"Light  Romance"
"Sonatine",0,"Movie","Action, Comedy, Crime",94,"Aya Kokumai, Tetsu Watanabe, Masanobu Katsumura",13980,7.5,"Bandai Visual Company",1993,29027,"JA","Japanese",2,"Action"
"Sorry We Missed You",0,"Movie","Drama",101,"Kris Hitchen, Debbie Honeywood, Rhys Stone",7868,7.6,"Sixteen Films",2019,7021,"UK","English",2,"Drama"
"Strangers on a Train",0,"Movie","Crime, Film-Noir, Thriller",101,"Farley Granger, Ruth Roman, Robert Walker",6454,7.9,"Warner Bros.",1951,32217,"US","English",2,"Horror/Thriller"
"Stray Cat Rock: Delinquent Girl Boss",0,"Movie","Action, Crime, Drama",80,"Akiko Wada, Meiko Kaji, Kôji Wada",39394,6.2,"Hori Production",1970,7765,"JA","Japanese",3,"Action"
"Submarine",0,"Movie","Comedy, Drama, Romance",97,"Noah Taylor, Paddy Considine, Craig Roberts",6439,7.3,"The Weinstein Company",2010,34465,"UK","English",4,"Romance"
"Subway",1,"Movie","Thriller",104,"Isabelle Adjani, Christopher Lambert, Richard Bohringer",11680,6.6,"Les Films du Loup",1985,30549,"FR","French",2,"Light"
"Sudden Impact",0,"Movie","Action, Crime, Thriller",117,"Sondra Locke, Pat Hingle, Bradford Dillman",6366,6.7,"Warner Bros.",1983,15877,"US","English",3,"Action"
"Summer",0,"Movie","Drama, Romance",99,"Amira Chemakhi, Sylvie Richez, Basile Gervaise",20325,7.7,"Ministère de la Culture et de la Communication",1986,16101,"FR","French",4,"Romance"
"Sunset Blvd.",1,"Movie","Drama, Film-Noir",110,"William Holden, Gloria Swanson, Erich von Stroheim",2859,8.4,"Paramount Pictures",1950,990,"US","English",2,"Horror/Thriller"
"Superbad",0,"Movie","Comedy",113,"Jonah Hill, Michael Cera, Christopher Mintz-Plasse",816,7.6,"Columbia Pictures",2007,32109,"US","English",3,"Light"
"Suspiria",0,"Movie","Horror",99,"Jessica Harper, Stefania Casini, Flavio Bucci",4144,7.4,"Seda Spettacoli",1977,8709,"IT","English",3,"Horror/Thriller"
"Sweet Sixteen",0,"Movie","Crime, Drama",106,"Martin Compston, William Ruane, Annmarie Fulton",10557,7.4,"Alta Films",2002,3258,"UK","English",3,"Drama"
"Sweet Smell of Success",0,"Movie","Drama, Film-Noir",96,"Susan Harrison, Martin Milner, Jeff Donnell",13513,8,"Norma Productions",1957,8032,"US","English",3,"Horror/Thriller"
"Sympathy for Mr. Vengeance",0,"Movie","Crime, Drama, Thriller",129,"Kang-ho Song, Shin Ha-kyun, Bae Doona",8234,7.6,"CJ Entertainment",2002,6904,"SK","Korean",2,"Horror/Thriller"
"T2 Trainspotting",1,"Movie","Drama",117,"Ewan McGregor, Logan Gillies, Ben Skelton",3966,7.2,"Artbees",2017,81775,"UK","English",3,"Drama"
"Talk Radio",0,"Movie","Drama",110,"Ellen Greene, Leslie Hope, John C. McGinley",19002,7.3,"Cineplex Odeon Films",1988,42027,"US","English",1,"Drama"
"Talk to Her",0,"Movie","Drama, Mystery, Romance",112,"Javier Cámara, Darío Grandinetti, Leonor Watling",7650,7.9,"El Deseo",2002,18541,"SP","Spanish",3,"Romance"
"Targets",1,"Movie","Crime, Drama, Thriller",90,"Tim O'Kelly, Boris Karloff, Arthur Peterson",19669,7.3,"Saticoy Productions",1968,6676,"US","English",3,"Horror/Thriller"
"Taxi Driver",0,"Movie","Crime, Drama",114,"Diahnne Abbott, Frank Adu, Victor Argo",689,8.2,"Columbia Pictures",1976,102782,"US","English",4,"Drama"
"Tenet",0,"Movie","Action, Sci-Fi, Thriller",150,"Juhan Ulfsak, Jefferson Hall, Ivo Uukkivi",83,7.5,"Warner Bros.",2020,61053,"US","English",3,"Action"
"Tepepa",1,"Movie","Action, Adventure, Drama",133,"Tomas Milian, Orson Welles, John Steiner",64074,6.7,"Filmamerica",1969,13013,"IT","Italian",2,"Action"
"That Sinking Feeling",0,"Movie","Comedy, Crime",93,"Tom Mannion, Eddie Burt, Alex Mackenzie",27977,6.8,"Glasgow Youth Theatre",1979,12708,"UK","English",2,"Light"
"The Addiction",0,"Movie","Drama, Horror",82,"Lili Taylor, Christopher Walken, Annabella Sciorra",21782,6.5,"Fast Films",1995,86268,"US","English",2,"Horror/Thriller"
"The Apartment",1,"Movie","Comedy, Drama, Romance",125,"Jack Lemmon, Shirley MacLaine, Fred MacMurray",4611,8.3,"The Mirisch Corporation",1960,7400,"US","English",2,"Romance"
"The Aviator",1,"Movie","Biography, Drama",170,"Cate Blanchett, Kate Beckinsale, John C. Reilly",1754,7.5,"Forward Pass",2004,33663,"US","English",2,"Drama"
"The Aviator's Wife",0,"Movie","Comedy, Drama, Romance",106,"Philippe Marlaud, Marie Rivière, Anne-Laure Meury",24617,7.6,"Les Films du Losange",1981,21990,"FR","French",3,"Romance"
"The Beach",1,"Movie","Adventure, Drama, Romance",119,"Leonardo DiCaprio, Daniel York, Patcharawan Patarakijjanon",2556,6.7,"Figment Films",2000,30876,"US","English",2,"Romance"
"The Beguiled",0,"Movie","Drama, Thriller, War",105,"Geraldine Page, Elizabeth Hartman, Jo Ann Harris",8582,7.2,"The Malpaso Company",1971,4628,"US","English",3,"Horror/Thriller"
"The Big Lebowski",1,"Movie","Comedy, Crime, Sport",117,"Jeff Bridges, John Goodman, Julianne Moore",694,8.1,"Polygram Filmed Entertainment",1998,3316,"US","English",4,"Light"
"The Big Sleep",1,"Movie","Crime, Film-Noir, Mystery",114,"Humphrey Bogart, Lauren Bacall, John Ridgely",8863,7.9,"Warner Bros.",1946,17365,"US","English",4,"Horror/Thriller"
"The Bird with the Crystal Plumage",0,"Movie","Horror, Mystery, Thriller",96,"Tony Musante, Suzy Kendall, Enrico Maria Salerno",9166,7.2,"Seda Spettacoli",1970,40837,"IT","English",3,"Horror/Thriller"
"The Brood",0,"Movie","Horror, Sci-Fi",92,"Oliver Reed, Samantha Eggar, Art Hindle",7930,6.9,"Canadian Film Development Corporation (CFDC)",1979,18290,"CA","English",3,"Horror/Thriller"
"The Collector",0,"Movie","Comedy, Drama, Romance",89,"Alain Jouffroy, Mijanou Bardot, Annik Morice",15240,7.5,"Les Films du Losange",1967,10133,"FR","French",2,"Romance"
"The Conformist",0,"Movie","Drama",113,"Jean-Louis Trintignant, Stefania Sandrelli, Gastone Moschin",9460,8,"Mars Film",1970,45477,"IT","Italian",4,"Drama"
"The Conversation",1,"Movie","Drama, Mystery, Thriller",113,"Gene Hackman, John Cazale, Allen Garfield",2683,7.8,"The Directors Company",1974,57307,"US","English",4,"Horror/Thriller"
"The Dark Knight",1,"Movie","Action, Crime, Drama",152,"Christian Bale, Aaron Eckhart, Michael Caine",167,9,"Warner Bros.",2008,7476,"US","English",3,"Action"
"The Dark Knight Rises",1,"Movie","Action, Adventure",164,"Christian Bale, Gary Oldman, Tom Hardy",426,8.4,"Warner Bros.",2012,4111,"US","English",3,"Action"
"The Death Wheelers",0,"Movie","Adventure, Horror",85,"Nicky Henson, Mary Larkin, Ann Michelle",24205,5.8,"Benmar Productions",1973,18398,"UK","English",2,"Horror/Thriller"
"The Departed",1,"Movie","Crime, Drama, Thriller",151,"Leonardo DiCaprio, Matt Damon, Jack Nicholson",459,8.5,"Warner Bros.",2006,38830,"US","English",3,"Drama"
"The Devils",0,"Movie","Biography, Drama, History",111,"Vanessa Redgrave, Oliver Reed, Dudley Sutton",5249,7.8,"Russo Productions",1971,22024,"UK","English",4,"Horror/Thriller"
"The Double",0,"Movie","Comedy, Drama, Mystery",93,"Jesse Eisenberg, Mia Wasikowska, Wallace Shawn",9553,6.5,"Alcove Entertainment",2013,26713,"US","English",2,"Drama"
"The Dreamers",0,"Movie","Drama, Romance",115,"Michael Pitt, Eva Green, Louis Garrel",1363,7.2,"Recorded Picture Company (RPC)",2003,19493,"US","English",2,"Romance"
"The Driver",1,"Movie","Action, Crime, Thriller",91,"Ryan O'Neal, Bruce Dern, Isabelle Adjani",11683,7.2,"EMI Films",1978,9526,"US","English",3,"Action"
"The Enforcer",1,"Movie","Action, Crime, Thriller",96,"Clint Eastwood, Tyne Daly, Harry Guardino",9693,6.8,"Warner Bros.",1976,1820,"US","English",2,"Action"
"The Firm",0,"Movie","Comedy, Drama, Mystery",90,"Paul Anderson, Calum MacNab, Daniel Mays",16906,5.8,"Vertigo Films",2009,29346,"UK","English",2,"Drama"
"The Football Factory",0,"Movie","Crime, Drama, Sport",91,"Danny Dyer, Tamer Hassan, Roland Manookian",13742,6.8,"Vertigo Films",2004,5969,"UK","English",3,"Light"
"The French Connection",0,"Movie","Action, Crime, Drama",104,"Fernando Rey, Roy Scheider, Tony Lo Bianco",3986,7.7,"Twentieth Century Fox",1971,42237,"US","English",1,"Action"
"The Gauntlet",0,"Movie","Action, Crime, Thriller",109,"Sondra Locke, Pat Hingle, William Prince",5523,6.4,"Warner Bros.",1977,32661,"US","English",3,"Action"
"The Gay Divorcee",1,"Movie","Comedy, Musical, Romance",107,"Fred Astaire, Ginger Rogers, Alice Brady",25310,7.5,"RKO Radio Pictures",1934,114913,"US","English",3,"Light  Romance"
"The Girl Can't Help It",0,"Movie","Comedy, Music",99,"Tom Ewell, Jayne Mansfield, Edmond O'Brien",28758,6.8,"Twentieth Century Fox",1956,144633,"US","English",1,"Light"
"The Girl on a Motorcycle",0,"Movie","Drama, Romance",91,"Marianne Faithfull, Roger Mutton, Marius Goring",19501,5.3,"Adel Productions",1968,36104,"EU","English",3,"Romance"
"The Godfather",1,"Movie","Crime, Drama",175,"Marlon Brando, Al Pacino, James Caan",97,9.2,"Paramount Pictures",1972,30540,"US","English",4,"Drama"
"The Good Thief",0,"Movie","Action, Crime, Drama",109,"Nutsa Kukhianidze, Ouassini Embarek, Tchéky Karyo",22966,6.5,"Alliance Atlantis Communications",2002,72299,"UK","English",1,"Action"
"The Good, the Bad and the Ugly",0,"Movie","Western",161,"Lee Van Cleef, Aldo Giuffrè, Luigi Pistilli",758,8.8,"Produzioni Europee Associate (PEA)",1966,2681,"IT","English",4,"Action"
"The Grand Budapest Hotel",1,"Movie","Adventure, Comedy, Crime",99,"Ralph Fiennes, F. Murray Abraham, Mathieu Amalric",508,8.1,"Fox Searchlight Pictures",2014,7417,"US","English",4,"Light"
"The Guard",0,"Movie","Comedy, Crime, Thriller",96,"Ronan Collins, Paraic Nialand, John Patrick Beirne",6222,7.3,"Reprisal Films",2011,3745,"IR","English",2,"Light"
"The Harder They Come",0,"Movie","Crime, Drama, Music",103,"Janet Bartley, Carl Bradshaw, Ras Daniel Hartman",27518,6.9,"International Films",1972,26057,"WO","Spanish",3,"Light"
"The Hill",1,"Movie","Drama, War",123,"Sean Connery, Harry Andrews, Ian Bannen",20636,7.9,"Metro-Goldwyn-Mayer (MGM)",1965,4323,"UK","English",3,"Drama"
"The Host",0,"Movie","Action, Drama, Horror",120,"Kang-ho Song, Byun Hee-Bong, Park Hae-il",4084,7.1,"Chungeorahm Film",2006,14209,"SK","Korean",3,"Horror/Thriller Action"
"The Housemaid",0,"Movie","Drama, Thriller",107,"Jeon Do-yeon, Jung-jae Lee, Yuh-Jung Youn",8455,6.4,"Sidus FNH-Benex Cinema Fund 1",2010,40492,"SK","Korean",2,"Drama"
"The Irishman",1,"Movie","Biography, Crime, Drama",209,"Al Pacino, Joe Pesci, Harvey Keitel",645,7.8,"Tribeca Productions",2019,10454,"US","English",4,"Drama"
"The Italian Job",1,"Movie","Action, Comedy, Crime",99,"Michael Caine, Noël Coward, Benny Hill",5302,7.3,"Oakhurst Productions",1969,237180,"UK","English",3,"Action"
"The King of Comedy",1,"Movie","Comedy, Crime, Drama",109,"Robert De Niro, Jerry Lewis, Diahnne Abbott",4378,7.8,"Embassy International Pictures",1982,4274,"US","English",2,"Drama"
"The Lighthouse",1,"Movie","Drama, Fantasy, Horror",109,"Robert Pattinson, Willem Dafoe, Valeriia Karaman",663,7.5,"A24",2019,262150,"US","English",3,"Horror/Thriller"
"The Long Goodbye",0,"Movie","Comedy, Crime, Drama",112,"Elliott Gould, Nina van Pallandt, Sterling Hayden",6652,7.6,"E-K-Corporation",1973,12217,"US","English",4,"Horror/Thriller"
"The Lord of the Rings: The Fellowship of the Ring",1,"Movie","Action, Adventure, Drama",178,"Alan Howard, Noel Appleby, Sean Astin",261,8.8,"New Line Cinema",2001,101506,"US","English",3,"Action"
"The Lord of the Rings: The Return of the King",1,"Movie","Action, Adventure, Drama",201,"Noel Appleby, Ali Astin, Sean Astin",514,8.9,"New Line Cinema",2003,91348,"US","English",2,"Action"
"The Lord of the Rings: The Two Towers",1,"Movie","Action, Adventure, Drama",179,"Bruce Allpress, Sean Astin, John Bach",756,8.7,"New Line Cinema",2002,13969,"US","English",3,"Action"
